infra,session_id,sentence,type,similarity,label
cdp-seattle-21723dcf,01a6d09dd442,Not least i want to thank members of the garfield super block for their work alongside our office in advocating for full funding for their project to renovate improve and add art and historical displace in the heart of seattle central district this community-led project started 15 years ago and it is time to finish it the coalition's updated plan melts the original plan's vision with new historic and culturally relevant public art installations site furnishings improved access play equipment water feature and an improved restroom facility when completed we know the garfield area will be a gem in the central district and i'm excited for my office to be advancing a supplemental budget amendment this month to add city public funds of five hundred thousand dollars into the garfield super block project and i urge council members to support it and i'm excited to join garfield super block organizers and community members this wednesday at 5 p.m to celebrate the project's progress and vision thank you thank you so much for that report are there any comments or questions on council member salons report uh council member herbal please thank you i'm just wanting to comment a little bit about the um entheogen bill um just as a little bit of background the bill was only made available in legistar on wednesday june 30th um i don't want to get into the whole issue of uh calls made i i don't have a way of knowing how many calls were made but um my staff um has received four voicemails um and three of them on this topic the fourth is was not on this topic at all um i when i um responded to uh ted verdone in council member swan's office um a couple weeks ago when they informed us that this bill was coming i let them know that i'd be meeting with um decriminalized nature to talk about um their ideas about around process and the content of the bill we subsequently myself and council member lewis subsequently attended one of their board meetings um it took them some time uh to uh consider um conversation that we had and get back to us uh we all have an email from them in our in our inbox this morning um again to clarify um the bill itself has not been assigned to a committee yet council president gonzalez um has i think um and i will let council president gonzalez speak for herself but um the uh the understanding is that we've all agreed the council uh when in signing the letter i'm asking that the overdose emergency and innovative recovery task force consider recommendations that the council has sort of agreed on a process for considering this uh policy and um i believe that referring the bill to a committee prior to um recommendations from from that committee is um is premature the legislation is not ripe and i um appreciate that the council president is um is uh is supporting the position that we have all taken regarding um at that policy um process just to um clarify the board of decriminalized nature seattle um emailed this weekend for their support uh for the um the task force and waiting for their recommendations there are several members of decriminalized uh nature seattle on task force self um and again there are concerns that introduction of this legislation would indicate a specific intent from council prior to receiving recommendations i think there is strong support on a council for um for uh recognizing the um the usefulness of um entheogens in um in uh public health contexts and interest in the policy objectives of of the legislation but again um i'm really hoping that we can um consider policy at a time when we have actually received recommendations uh from the folks who are who are looking at this issue thank you thank you council member herbal sorry it took me a minute there to find my mute button um okay uh any other comments or questions oh councilor salon please first of all on uh i just find this response to the question of phone calls and voicemails somewhat absurd and disingenuous i mean yes it's true that my staff member did not leave a voicemail on every call he made but he made 23 calls and he probably may left four voicemails yes you're right councilman herbal but it would be uh completely crazy for him to leave 23 voicemails no nobody in their right mind would do that i mean four voicemails should be ample for uh staff members and i mean you know it's your office ultimately uh you know it's not about staff members it's about the office as a whole for you to know that we uh care about this issue and we're looking for a response and i appreciate that you have spoken openly today but this is the response we were uh seeking when we reached out to your office so many times seeking when we reached out to your office so many times uh but leaving that aside on the question about what that letter that all of us signed says there was no comment about a process for this legislation in that letter that letter did not say one word about that process,random,0.0,False
cdp-seattle-21723dcf,01a6d09dd442,Across our nation later today i will be attending the kickoff of the public health director's recruitment community advisory committee that is a mouthful for basically saying the body that will look be looking for an individual to replace outgoing director patty hayes from public health seattle king county again a long time a friend and mentor of mine we do wish her luck and this national search brings together direct advisors members from king county and seattle to identify the next public health leader so very excited about that and of course if you have recommendations there is a robust recruitment process so please please let me know if i can get that information to you,random,0.0,False
cdp-seattle-21723dcf,01a6d09dd442,Then on july 7th we heard from the customer review panel about why they endorsed the strategic plan and support its adoption by this council we like i said we unanimously recommended the approval,random,0.0,False
cdp-seattle-21723dcf,01a6d09dd442,Again our central staff analyst eric mcconaghy is available to answer any questions we unanimously recommended approval of that,random,0.0,False
cdp-seattle-21723dcf,01a6d09dd442,More details will be available on july 20th on july 18th or on july 8th i also attended the psrc transportation policy board which received updates on regional transportation planning and has a special presentation on impacts on the transportation network of puget sound and water quality and finally in regards to sound transit we were set to vote on realignment on thursday july 22nd that date has been moved to august 5th that's giving us some time to get our amendments in and giving council member or board member balducci an opportunity to add more of comments and concerns and address some additional language in her resolution which will be looking at both of them resolution of board member balducci and the resolution proposed by the board chair mr kent keel that's it thank you back to you council president thank you so much council member juarez any comments or questions on that report hearing on we'll go ahead and go down the line next up is council member lewis followed by council member morales good morning thank you madam president there are no items on the introduction referral calendar from my office or expected to go to the select committee on homelessness strategies and investments the committee will have its next meeting on july 28th wednesday july 28th where we will again take up council bill 120109 that will establish a fund to accept private gifts to assist in our strategic efforts to address the state of emergency of homelessness we will also have a presentation from the human services department reporting back on their progress to stand up additive emergency shelter investments and and progress on the attached rapid rehousing program that the council funded as part of our budget in the fall of last year for 2021 so do please forward to my office any questions or communicate with hsd directly if you have some things you would like hsd to be prepared for for that presentation i certainly have a lot of questions in regards to the shelter assets and rapid rehousing as i'm sure my colleagues here do as well king county regional homelessness authority will meet this thursday and i will be attending that meeting along with council president gonzalez and mayor jenny durkin as part of seattle's delegation to that body we will hear an update from ceo mark dones on their staffing plan to staff up the the new regional homelessness authority we will also hear an update on the early stages of mark done strategic plan to address the homelessness emergency here in king county uh you know including the city seattle,random,0.0,False
cdp-seattle-21723dcf,01a6d09dd442,If you have any questions about this our central staff analyst eric mcconaghy is available between this council briefing and our full council meeting this afternoon this afternoon we'll also vote to adopt council bill 120103 to authorize seattle city light to enter into a long-term lease with the non-profit community development authority to take care of the old georgetown steam plant structure which is a national historical landmark for council members not on the transportation utilities committee,random,0.0,False
cdp-seattle-21723dcf,20dc9c63e26e,Mayor Durkin's executive order.,random,0.0,False
cdp-seattle-21723dcf,20dc9c63e26e,"If you look at the data, you will see that this is happening even though the police budget has been bloated.",random,0.0,False
cdp-seattle-21723dcf,20dc9c63e26e,Strauss.,random,0.0,False
cdp-seattle-21723dcf,20dc9c63e26e,"For this top priority, colleagues, with your help, we secured $2.5 million to increase the size of the mobile crisis team so there is an appropriate first responder for people in crisis in our community.",random,0.0,False
cdp-seattle-21723dcf,20dc9c63e26e,Mi deseo es poder seguir contando con el apoyo de ustedes para la legislaciÃ³n de los beneficios portÃ¡tiles en el 2022.,random,0.0,False
cdp-seattle-21723dcf,20dc9c63e26e,"Any comments on agenda item 13, which is council bill one two zero one nine one.",random,0.0,False
cdp-seattle-21723dcf,20dc9c63e26e,It's in the item 11 resolution three two zero two four.,random,0.0,False
cdp-seattle-21723dcf,09fbebde2426,"I thought you were perhaps waving and saying you were good last time, but you were waving and saying, no, stop.",random,0.0,False
cdp-seattle-21723dcf,09fbebde2426,Council president Gonzalez?,random,0.0,False
cdp-seattle-21723dcf,09fbebde2426,Thanks to each and every council member who signed on to this proclamation this morning.,random,0.0,False
cdp-seattle-21723dcf,09fbebde2426,We appreciate your support.,random,0.0,False
cdp-seattle-21723dcf,09fbebde2426,Go ahead.,random,0.0,False
cdp-seattle-21723dcf,09fbebde2426,It's really hard to hear you.,random,0.0,False
cdp-seattle-21723dcf,aa0009d09bf4,"Colleagues, any additional comments on Amendment 5?",random,0.0,False
cdp-seattle-21723dcf,aa0009d09bf4,Whereas the parcels shown in green on this slide are tied to the license.,random,0.0,False
cdp-seattle-21723dcf,aa0009d09bf4,"But in general, I would say that it's a return on investment question and it's very expensive.",random,0.0,False
cdp-seattle-21723dcf,aa0009d09bf4,"As the new head of the Federal Communications Commission is saying, access to high-speed Internet is no longer a nice habit.",random,0.0,False
cdp-seattle-21723dcf,aa0009d09bf4,"Well, thank you.",random,0.0,False
cdp-seattle-21723dcf,aa0009d09bf4,We're really excited about some of this data information that we have.,random,0.0,False
cdp-seattle-21723dcf,aa0009d09bf4,At least more remote for people.,random,0.0,False
cdp-seattle-21723dcf,aa0009d09bf4,"I don't have a slide to do that, but I'm prepared to just give kind of a high level.",random,0.0,False
cdp-seattle-21723dcf,65d7d6ac6178,No.,random,0.0,False
cdp-seattle-21723dcf,65d7d6ac6178,I don't have any questions.,random,0.0,False
cdp-seattle-21723dcf,65d7d6ac6178,So it's not that they can't be evicted based on that.,random,0.0,False
cdp-seattle-21723dcf,65d7d6ac6178,Remain more expansive for the.,random,0.0,False
cdp-seattle-21723dcf,65d7d6ac6178,"To create some important legislation that can really provide a powerful fix to the city's just cause eviction ordinance and ensure that all tenants, regardless of where they are in their lease term or what kind of contract they have, that there'll be protected from a threat of no fault, no cause removal from their home.",random,0.0,False
cdp-seattle-21723dcf,65d7d6ac6178,My name is Angie and I'm a small housing provider in the Ballard Phinney area.,random,0.0,False
cdp-seattle-21723dcf,65d7d6ac6178,Renters bill of rights that we have been.,random,0.0,False
cdp-seattle-21723dcf,65d7d6ac6178,It's a significant step in the right direction.,random,0.0,False
cdp-seattle-21723dcf,65d7d6ac6178,Council member Morales.,random,0.0,False
cdp-seattle-21723dcf,65d7d6ac6178,When the moratorium and the moratoria and the six month defense bill expire.,random,0.0,False
cdp-seattle-21723dcf,d594eaa5e872,"I only have one technical question, and it's about logistics.",random,0.0,False
cdp-seattle-21723dcf,d594eaa5e872,Are there any comments or questions on that report?,random,0.0,False
cdp-seattle-21723dcf,d594eaa5e872,"Six years later, here we are with an opportunity to celebrate this inclusive and accessible public art installation that, again, acknowledges this important issue that continues to impact our entire community, but especially our LGBTQ-plus community members.",random,0.0,False
cdp-seattle-21723dcf,d594eaa5e872,"You can also not only visit the website, but you can also visit our site as well.",random,0.0,False
cdp-seattle-21723dcf,d594eaa5e872,So it's correct that activists led by the Palestinian coalition in Seattle and also activists worldwide have targeted these ships.,random,0.0,False
cdp-seattle-21723dcf,d594eaa5e872,"That beautiful mural says, ensure our future, not tar sands.",random,0.0,False
cdp-seattle-21723dcf,d594eaa5e872,"So tomorrow's committee will also discuss rent control frequently asked questions, and we'll go over what kind of rent control policy we need and how we have to completely reject the kind of loopholes that have been put in place in other rent control laws.",random,0.0,False
cdp-seattle-21723dcf,d594eaa5e872,I have several items on this afternoon's calendar.,random,0.0,False
cdp-seattle-21723dcf,d594eaa5e872,"So what we do at Native Action Network is we provide a pipeline, an educational cultural space to mentor and help Indigenous women become greater leaders in their communities and beyond.",random,0.0,False
cdp-seattle-21723dcf,d594eaa5e872,"Sometime, I think this week or next week, we've been preparing, and I will be sharing with my colleagues, some legislation, some draft legislation regarding the acknowledgement or the trauma that indigenous families and children have experienced from residential schools and boarding schools.",random,0.0,False
cdp-seattle-21723dcf,f6e1f3c08a43,"VSOP will contribute $500,000 towards the development and maintenance of the new plaza, so that's important because we're not just, they're not just creating it without having an ongoing maintenance plan so that it would just sort of, nobody would be responsible.",random,0.0,False
cdp-seattle-21723dcf,f6e1f3c08a43,This is small.,random,0.0,False
cdp-seattle-21723dcf,f6e1f3c08a43,"I would note that all of the departments retain records consistent with the state retention schedule, which is actually codified in RCW.",random,0.0,False
cdp-seattle-21723dcf,f6e1f3c08a43,"Rachel, are you there?",random,0.0,False
cdp-seattle-21723dcf,f6e1f3c08a43,"You can't, if we cut down that tree, it would take, we would not be able to recoup that growth.",random,0.0,False
cdp-seattle-21723dcf,f6e1f3c08a43,"And thank you to everyone from SDOT, Nico, great to be here and Candida, great presentation today.",random,0.0,False
cdp-seattle-21723dcf,f6e1f3c08a43,Departmental.,random,0.0,False
cdp-seattle-21723dcf,f6e1f3c08a43,You can reach out to the individual departments.,random,0.0,False
cdp-seattle-21723dcf,f6e1f3c08a43,"We also presented at Seattle Design Commission subcommittee meeting, and so we've adjusted some of the design to reflect their comments.",random,0.0,False
cdp-seattle-21723dcf,f6e1f3c08a43,"Yes, we'd like to.",random,0.0,False
cdp-seattle-21723dcf,42537655cf11,And then other housing money is similar to what Quinn is saying.,random,0.0,False
cdp-seattle-21723dcf,42537655cf11,"This one actually did pass out of the Policy Committee, so it is still alive.",random,0.0,False
cdp-seattle-21723dcf,42537655cf11,"I've been honored to be able to work with you and support you on that, and we'll be holding my comments on that until after your presentation today on that item.",random,0.0,False
cdp-seattle-21723dcf,42537655cf11,"They have properly disposed of 26,000 needles, visited encampments 293 times to collect trash and garbage, and cleaned graffiti from over 200 structures.",random,0.0,False
cdp-seattle-21723dcf,42537655cf11,"Okay, hearing none, we're almost done here, folks.",random,0.0,False
cdp-seattle-21723dcf,42537655cf11,Facilities staff provided tents for entryways and custodian salted access pathways.,random,0.0,False
cdp-seattle-21723dcf,42537655cf11,We just didn't have time.,random,0.0,False
cdp-seattle-21723dcf,42537655cf11,"We really need to focus on how we are going to get to a place where people come back downtown to live, to work, to play, to shop, and to have businesses.",random,0.0,False
cdp-seattle-21723dcf,42537655cf11,Senate Bill 5160 is therefore even more critically important since it's the only vehicle at play to address the end of the eviction moratorium.,random,0.0,False
cdp-seattle-21723dcf,42537655cf11,"There are no items from the Land Use and Neighborhoods Committee on today's full agenda, and the next meeting of the Land Use and Neighborhoods Committee is on February 24th at 9.30 a.m.",random,0.0,False
cdp-seattle-21723dcf,5d71e3116ccd,"Thank you, Councilmember Pedersen.",random,0.0,False
cdp-seattle-21723dcf,5d71e3116ccd,"So, just a reminder to the viewing public, a lot of you think of us as issuing permits and administering the designer review program, but we're also very involved with Codevelopment with code enforcement.",random,0.0,False
cdp-seattle-21723dcf,5d71e3116ccd,"We've already rolled out licenses were a number of plan reviewers, so they are using a tool as a viewer as opposed to Adobe pro, where you can view those Pdfs that are submitted as part of the applications, and we're fully integrating it with our excel Implementations, so when correction letters are written and corrections are reviewed, that those letters and those documents will Upload into our electronic document and notify the applicant right of way as soon as available . We have partnered with other jurisdictions around state.",random,0.0,False
cdp-seattle-21723dcf,5d71e3116ccd,"Chair Strauss, I think you and Councilmember Pedersen covered it.",random,0.0,False
cdp-seattle-21723dcf,5d71e3116ccd,It has been moved and Seconded.,random,0.0,False
cdp-seattle-21723dcf,7f74c8c60869,That's about one to zero one 87.,random,0.0,False
cdp-seattle-21723dcf,7f74c8c60869,They're actually failing.,random,0.0,False
cdp-seattle-21723dcf,7f74c8c60869,I live in District 7 at 1st and Cherry Street.,random,0.0,False
cdp-seattle-21723dcf,7f74c8c60869,"For the first time in decades, council members will have to face the consequences of the bullying, antisocial intransigence that imbues police culture.",random,0.0,False
cdp-seattle-21723dcf,7f74c8c60869,"As an activist with the eight-year-long people's budget movement, I support the efforts of my fellow community members, organizing with the solidarity budget, and I really hope we can work together and push the city council to increase the Amazon tax by $120 million so we can have a real economic recovery.",random,0.0,False
cdp-seattle-21723dcf,7f74c8c60869,I'm also a member of Local 30.,random,0.0,False
cdp-seattle-21723dcf,d62acc3d7c0a,Let me share a presentation.,random,0.0,False
cdp-seattle-21723dcf,d62acc3d7c0a,Please begin speaking by stating your name and the agenda item in which you are addressing speakers will hear a chime when tech and 10 seconds are left of the allotted time once the speakers.,random,0.0,False
cdp-seattle-21723dcf,d62acc3d7c0a,"We ask that you please disconnect from the line and if you plan to continue following this meeting, please do so via the Seattle channel or the listening options listed on the agenda.",random,0.0,False
cdp-seattle-21723dcf,d62acc3d7c0a,It says no development allowed in that white section of the lot.,random,0.0,False
cdp-seattle-21723dcf,d62acc3d7c0a,So there was a request that they be brought into the reason as well.,random,0.0,False
cdp-seattle-21723dcf,d20830106f1f,"Like she said, my name is Kirsten, and I work for QFC Uptown in the Queen Anne area by the Seattle Center.",random,0.0,False
cdp-seattle-21723dcf,d20830106f1f,So I'm feeling confident that it addresses that question. of compensation.,random,0.0,False
cdp-seattle-21723dcf,d20830106f1f,"I am with Council Central staff, and I have prepared a presentation for the committee that includes an overview of the introduced legislation.",random,0.0,False
cdp-seattle-21723dcf,d20830106f1f,We wanted to make sure that our residents there had a chance to access testing sites and access the flu vaccination as it became available.,random,0.0,False
cdp-seattle-21723dcf,d20830106f1f,"They're going to build a major medical facility at Yesler, more moving towards the vision of Yesler as a mixed-income, mixed-use neighborhood, and really hopeful about partnering with them and having jobs in the neighborhood and having a diversity of uses.",random,0.0,False
cdp-seattle-21723dcf,d20830106f1f,Thank you very much.,random,0.0,False
cdp-seattle-21723dcf,d20830106f1f,Getting back to the comment earlier about having residents reap the benefits of some of those.,random,0.0,False
cdp-seattle-21723dcf,d20830106f1f,"Yes, I am.",random,0.0,False
cdp-seattle-21723dcf,d20830106f1f,"Thank you, Madam Chair.",random,0.0,False
cdp-seattle-21723dcf,650a08ca4118,I cede the rest of my time.,random,0.0,False
cdp-seattle-21723dcf,650a08ca4118,"And we would like to get as much support as we can statewide as this is a very beneficial effect of bringing cultures together, which even helps combat racism and other things because we have cultures from all over the world contributing this music that people can hear and also learn about.",random,0.0,False
cdp-seattle-21723dcf,650a08ca4118,"Oh, one more time.",random,0.0,False
cdp-seattle-21723dcf,650a08ca4118,"Next up is Brian Lindman, followed by Evan Berg.",random,0.0,False
cdp-seattle-21723dcf,650a08ca4118,Hi there.,random,0.0,False
cdp-seattle-21723dcf,650a08ca4118,We provide and connect African arts and culture to youth and families.,random,0.0,False
cdp-seattle-21723dcf,650a08ca4118,I'll call on each speaker by name and in the order in which they've registered on the Council's website.,random,0.0,False
cdp-seattle-21723dcf,baf9d6f05851,We seek durable and equitable solutions that are in line with our mission vision and values.,random,0.0,False
cdp-seattle-21723dcf,baf9d6f05851,A lot of different interests in one levy oversight committee and everybody brings their own perspective which I think leads to a more robust conversation and oversight of all of the levy dollars but just just thought it would be helpful for us to hear from you sort of your philosophy about philosophy around how you navigate those those different perspectives as a member of this oversight committee.,random,0.0,False
cdp-seattle-21723dcf,baf9d6f05851,Its contract terms continue into 2028.,random,0.0,False
cdp-seattle-21723dcf,baf9d6f05851,Upon accepting the application the city subsequently conducted a traffic study that uncovered a collision pattern.,random,0.0,False
cdp-seattle-21723dcf,baf9d6f05851,My final question is if I go on a tour with you may I will I receive some of those salmon glasses that I saw in slide 12?,random,0.0,False
cdp-seattle-21723dcf,baf9d6f05851,Thank you so much for the opportunity to present to you all today.,random,0.0,False
cdp-seattle-21723dcf,baf9d6f05851,I now turn over the presentation to Joel Darnell the project manager to talk more about the project.,random,0.0,False
cdp-seattle-21723dcf,baf9d6f05851,Wonderful not a precondition just really love all of your work.,random,0.0,False
cdp-seattle-21723dcf,25cd720cac89,"In order to allow as many speakers as possible to speak, there are no objections.",random,0.0,False
cdp-seattle-21723dcf,25cd720cac89,And so these are just the recommendations that I would have on recreating the CJCC.,random,0.0,False
cdp-seattle-21723dcf,25cd720cac89,One of those will likely be Crisis Connections.,random,0.0,False
cdp-seattle-21723dcf,25cd720cac89,The criminal legal system includes the city attorney's office.,random,0.0,False
cdp-seattle-21723dcf,25cd720cac89,"So, if an officer responds to a situation, determines there's some type of, again, broad term crisis issue that's going on, there's no real law enforcement role here, officers can make that call directly from the field to Mobile Crisis Team to the tune of, you know, we're in the five, six hundred a year that officers are making those direct referrals to Mobile Crisis Team.",random,0.0,False
cdp-seattle-21723dcf,25cd720cac89,But I think it does a really good job of encapsulating how it is that even three days of jail can impact so many different aspects of this individual's life.,random,0.0,False
cdp-seattle-21723dcf,25cd720cac89,"And so we'll go through these really briefly, but you can see defining the problem through information collection analysis.",random,0.0,False
