infra,session_id,sentence,type,similarity,label
cdp-seattle-21723dcf,0bc6e006b028,"And what I mean by lived experience is they're somebody either with an existing mental illness, substance use disorder, and have had some sort of crisis connection or issue within our system.",random,0.0,False
cdp-seattle-21723dcf,0bc6e006b028,"During the interview process, over 50 staff members participated in candidate interviews and all finalists met with our race and social justice change team.",random,0.0,False
cdp-seattle-21723dcf,09e8ad8f49ba,That total of $77 million would be maintained in the 2022 budget.,random,0.0,False
cdp-seattle-21723dcf,09e8ad8f49ba,"And as I noted previously, this compliments FG one, a one.",random,0.0,False
cdp-seattle-21723dcf,09e8ad8f49ba,I also have heard from members of protect 17 who represent members within service that they are supportive of.,random,0.0,False
cdp-seattle-21723dcf,09e8ad8f49ba,Build up and then assess the entire system.,random,0.0,False
cdp-seattle-21723dcf,09e8ad8f49ba,"As Lisa noted, we do have one additional walk on item.",random,0.0,False
cdp-seattle-21723dcf,09e8ad8f49ba,"Additionally, I wanted to voice my support for some important proposed budgetary amendments.",random,0.0,False
cdp-seattle-21723dcf,09e8ad8f49ba,And I am here today asking the council to re-continue funding for El Centro de la Raza.,random,0.0,False
cdp-seattle-21723dcf,09e8ad8f49ba,"So this position would make sure that that position is permanent and if they are still able to have grants and donations, it would expand their ability to rehouse animals in a meaningful way.",random,0.0,False
cdp-seattle-21723dcf,09e8ad8f49ba,"And as you know, housing providers need to be able to depend on this fund and know that the investments are reliable and predictable.",random,0.0,False
cdp-seattle-21723dcf,09e8ad8f49ba,Currently volunteers are struggling to manage that.,random,0.0,False
cdp-seattle-21723dcf,94fc8f2e670b,Is one area where I think we have upped our game. We,random,0.0,False
cdp-seattle-21723dcf,94fc8f2e670b,You. I,random,0.0,False
cdp-seattle-21723dcf,94fc8f2e670b,Next slide.,random,0.0,False
cdp-seattle-21723dcf,94fc8f2e670b,There's a rating they do called the RP3 which stands for a reliable public power provider.,random,0.0,False
cdp-seattle-21723dcf,94fc8f2e670b,We are at a pivotal time as we inch ever closer to the end of the pandemic and anxiously await the potential for swift economic recovery.,random,0.0,False
cdp-seattle-21723dcf,94fc8f2e670b,"If riders have to wait at a Soto station while full trains go by, it will hinder success of the whole system and really highlights the need for integration and cooperation between transit and Metro and Soto. So",random,0.0,False
cdp-seattle-21723dcf,94fc8f2e670b,I just have with the chair's cooperation I would like to ask one more question. Sure.,random,0.0,False
cdp-seattle-21723dcf,94fc8f2e670b,"And just as a reminder, the 2021 rate increase replaced a rate decrease in RSA surcharges.",random,0.0,False
cdp-seattle-21723dcf,94fc8f2e670b,"Welcome Seattle Public Utilities to our committee again and this next item, Council Bill 120100 will approve a very low interest loan as already planned to finance $66 million of the $570 million Ship Canal Project.",random,0.0,False
cdp-seattle-21723dcf,94fc8f2e670b,Were some fairly major components which weren't well defined at the station that led to early estimates being low. We,random,0.0,False
cdp-seattle-21723dcf,b6ea23f7a9a3,"Will the clerk please call the roll on the passage of item 8, which is, hold on a minute, I'm scrolling here, Council Bill 12072.",random,0.0,False
cdp-seattle-21723dcf,b6ea23f7a9a3,Are there any additional comments?,random,0.0,False
cdp-seattle-21723dcf,b6ea23f7a9a3,The COVID crisis has become a COVID bonanza for gig companies.,random,0.0,False
cdp-seattle-21723dcf,b6ea23f7a9a3,Will the clerk please read Item 7 into the record?,random,0.0,False
cdp-seattle-21723dcf,b6ea23f7a9a3,"So it's my hope that this bill will help improve and streamline the process of ordering for customers, making the food reflective of an up-to-date menu for restaurants, and that delivery drivers can just focus on pickups and making deliveries.",random,0.0,False
cdp-seattle-21723dcf,b6ea23f7a9a3,Just moving backwards a little bit for some context first before I get into the details of that substitute bill and amendment.,random,0.0,False
cdp-seattle-21723dcf,b6ea23f7a9a3,"Council President, that is the summary of these five appointments, and I urge a yay vote on all of them.",random,0.0,False
cdp-seattle-21723dcf,07b950311439,"In the community this week, I will be attending a rally in Pickett on August 4th with our brothers and sisters in SCIU 1199, nurses and other healthcare professionals at Harborview who are fighting very, very hard for an equitable and just contract, really looking forward to going and meeting more about some of the hurdles that the union is facing and how we, as public leaders, can support their efforts.",random,0.0,False
cdp-seattle-21723dcf,07b950311439,"When we have millions of people who are still unvaccinated, including children who are under 12 and immunocompromised people who are still at risk, and when the Delta variant is increasing the risk for each of us to contract COVID, it only makes sense that each of our community members, including our business neighbors, take every measure possible to protect workers, to protect children, and just to protect every other neighborhood, every other neighbor in our city.",random,0.0,False
cdp-seattle-21723dcf,07b950311439,"I look forward to co-sponsoring that legislation and supporting this Council's priority to get that village up and running, that village which was funded under CBA HOM-009-B-002, I believe, as a separate budget item separate from the other tiny house villages.",random,0.0,False
cdp-seattle-21723dcf,07b950311439,Our City's Transportation and Utilities Committee has no items on this afternoon's full City Council agenda.,random,0.0,False
cdp-seattle-21723dcf,07b950311439,So the last step is approval of this lease so we get more people off the streets into their own space and on to a positive future.,random,0.0,False
cdp-seattle-21723dcf,07b950311439,We have proposed multiple amendments specifically for the Graham Street infill station and the 130th Street infill station.,random,0.0,False
cdp-seattle-21723dcf,07b950311439,I know that staff was crazy busy for the last year and a half.,random,0.0,False
cdp-seattle-21723dcf,07b950311439,"Thank you, Madam President.",random,0.0,False
cdp-seattle-21723dcf,b8891923b600,We remarked in a lot of the conversations we have had with DOJ around consent decrees and the experts they use and some of the research team here at SPD.,random,0.0,False
cdp-seattle-21723dcf,b8891923b600,So again really appreciate the willingness of Oam to continue working with those communities to determine whether or not there is more we need to consider in a future plan.,random,0.0,False
cdp-seattle-21723dcf,b8891923b600,"This report is an obscene Whitewash and demonstrates the you are end need for us to have full civilian quality control over police policy, misconduct investigations and discipline.",random,0.0,False
cdp-seattle-21723dcf,b8891923b600,We have Matthew Butler who will do most of the presenting this morning.,random,0.0,False
cdp-seattle-21723dcf,b8891923b600,So now Seattle is in the position to lead by being an early Adopter of Decriminalizing Psychedelic plants.,random,0.0,False
cdp-seattle-21723dcf,b8891923b600,The members of the panel who were not police were academics from Pennsylvania and the U.K.,random,0.0,False
cdp-seattle-21723dcf,b8891923b600,They have been rewritten so that they are more Inclues Toif women and people of color.,random,0.0,False
cdp-seattle-21723dcf,b8891923b600,It is about how you bring these principles into your everyday work and the work you have done around key stride vaccination and Covid testing in 2020 and 2021 is a shining example of your commitment to racial equity.,random,0.0,False
cdp-seattle-21723dcf,b8891923b600,This proposal will not be the Pronl Posal.,random,0.0,False
cdp-seattle-21723dcf,062f6b2b2003,Go.,random,0.0,False
cdp-seattle-21723dcf,062f6b2b2003,I think we would have to review our points of order and how they are brought up specifically.,random,0.0,False
cdp-seattle-21723dcf,062f6b2b2003,"So add more flexibility to the rules, but have it be the Council President or the Committee Chair that is ultimately sort of making a decision about how those committees are run.",random,0.0,False
cdp-seattle-21723dcf,062f6b2b2003,"I'd like to hear from my colleagues what they think about council briefing every other week in which we talk about what we've done, what we're going to do, and other issues that actually brief the public instead of having three-hour morning meetings sometimes where we hear the same thing again at two.",random,0.0,False
cdp-seattle-21723dcf,062f6b2b2003,"During your public comment, you will hear a chime, and that chime is notice that there is ten seconds left of the two minutes that were provided to you.",random,0.0,False
cdp-seattle-21723dcf,062f6b2b2003,So it's taking a current practice and adopting it into permanent form.,random,0.0,False
cdp-seattle-21723dcf,062f6b2b2003,So I just wanted to offer that up as folks are sort of mulling over the concept of making council briefings biweekly or not.,random,0.0,False
cdp-seattle-21723dcf,062f6b2b2003,"Right now, there are criteria for paid family leave, you know, that are very specific.",random,0.0,False
cdp-seattle-21723dcf,062f6b2b2003,"So I do think that that one was still in the running, as they may say.",random,0.0,False
cdp-seattle-21723dcf,f18ba226a2cd,"And then the next question would be, is HSD going to then be extending new shelter offers as people move out of the Executive Pacific and the Just Care hotels to allow new people to come in to the shelters to make sure that we're continuing to offer folks on the street a place to go?",random,0.0,False
cdp-seattle-21723dcf,f18ba226a2cd,"It appears we're not automatically cutting people off when time expires, which is good, but sorry, I just wanted to just politely mention that, but really appreciate what you're bringing up and that'll be addressed in the committee today.",random,0.0,False
cdp-seattle-21723dcf,f18ba226a2cd,"But Mark, I would love for you to add the authority's perspective as these funds and projects will come under your roof soon.",random,0.0,False
cdp-seattle-21723dcf,f18ba226a2cd,"We have hundreds of volunteers at the ready, dozens of already constructed tiny houses ready to go and have laid the groundwork in the community by forming community advisory committees composed of local businesses, faith leaders and community members.",random,0.0,False
cdp-seattle-21723dcf,f18ba226a2cd,Here's another example of a new partnership for us.,random,0.0,False
cdp-seattle-21723dcf,f18ba226a2cd,"So you could have a scenario, for example, where you could have 230 people with the rapid rehousing voucher support, but then you could also have all 220 hotel rooms full because as people go to rapid rehousing, a new person comes in the hotel.",random,0.0,False
cdp-seattle-21723dcf,f18ba226a2cd,"We encourage them to dream up their future, what their housing looks like, what their relationships look like and what they wanna be doing with their time.",random,0.0,False
cdp-seattle-21723dcf,f18ba226a2cd,"And this might be more of a question for Mark given when we would be considering an investment like this, but in terms of the feedback from our friends over at the Lived Experience Coalition who've been doing a lot of engagement with the rapid rehousing program, gave a lot of feedback around the length and the amount of time of the subsidy and wanting to explore expanding that to a two-year subsidy.",random,0.0,False
cdp-seattle-21723dcf,f18ba226a2cd,And I'm gonna lean a little bit into Mark who I know is going to address those concerns as well.,random,0.0,False
cdp-seattle-21723dcf,f18ba226a2cd,"Please clarify if that's correct, Tess.",random,0.0,False
cdp-seattle-21723dcf,726ec414e79f,Council President Gonzalez and the staff at Team Lorena.,random,0.0,False
cdp-seattle-21723dcf,726ec414e79f,Peterson.,random,0.0,False
cdp-seattle-21723dcf,726ec414e79f,"Thank you, Councilmember Mosqueda and Council President Gonzalez.",random,0.0,False
cdp-seattle-21723dcf,726ec414e79f,"Next up is Louise, followed by Madison Swain Bowden, and then Emi Koyama.",random,0.0,False
cdp-seattle-21723dcf,726ec414e79f,There a second? Second.,random,0.0,False
cdp-seattle-21723dcf,726ec414e79f,"Want to speak on Agenda No. 7, the Hazard Pay Extension. I've",random,0.0,False
cdp-seattle-21723dcf,726ec414e79f,Is there a place where the Green New Deal Oversight Board can be on the agenda to offer its recommendations to the full Council?,random,0.0,False
cdp-seattle-21723dcf,726ec414e79f,Can you hear me?,random,0.0,False
cdp-seattle-21723dcf,ad93acca5e2b,"Rachel, Trayvon fields, Deb Barker, Aaron.",random,0.0,False
cdp-seattle-21723dcf,ad93acca5e2b,Thank you Council member Lewis.,random,0.0,False
cdp-seattle-21723dcf,ad93acca5e2b,Those homes and their value don't seem to suffer.,random,0.0,False
cdp-seattle-21723dcf,ad93acca5e2b,The legislation we are here to talk about today is in direct response to--the terrible impact the pandemic has had on our business community as I think most people are aware we lost over 40 had 0 businesses in the core due to the pandemic and the need for people to stay at home.,random,0.0,False
cdp-seattle-21723dcf,ad93acca5e2b,I think we are wrapping up.,random,0.0,False
cdp-seattle-21723dcf,ad93acca5e2b,We need a more accurate name than the one that has been with us since 1994.,random,0.0,False
cdp-seattle-21723dcf,ad93acca5e2b,Also going to low canopy coverage areas throughout the city so if they are going to plan replacement trees that aren't on the terrace site or within a few blocks but--there should be low tree canopy areas and we already have an assessment measuring that for the city.,random,0.0,False
cdp-seattle-21723dcf,ad93acca5e2b,I wanted to acknowledge that one of my constituents worked hard on a couple of proposals but did not make it through.,random,0.0,False
cdp-seattle-21723dcf,c41fc65bed07,"The motion carries, and the committee recommendation will be that the Council Bill be passed and will be sent for approval to the September 20, 2021 City Council meeting.",random,0.0,False
cdp-seattle-21723dcf,c41fc65bed07,"The city got a grant, a couple of grants, but in 2016, the city got a grant from the U.S. National Institute of Justice.",random,0.0,False
cdp-seattle-21723dcf,c41fc65bed07,So we did do that this year.,random,0.0,False
cdp-seattle-21723dcf,c41fc65bed07,"And going forward, you'll see it there every year.",random,0.0,False
cdp-seattle-21723dcf,c41fc65bed07,"We provide information to the Seattle City Council to help it in its role of overseeing Seattle City government, and we make recommendations to city departments to help them do better work and avoid risk.",random,0.0,False
cdp-seattle-21723dcf,c41fc65bed07,"But, you know, we will, we'll let you know how that specifically will play out, but thank you for asking, but that's like the one challenge that I, that I see on, I'm really excited about trying to meet that challenge.",random,0.0,False
cdp-seattle-21723dcf,c41fc65bed07,"And just as a reminder, the Seattle Department of Human Resources reviews whether jobs should have civil service protections, either upon the request of the department, who may have noticed that the job duties have changed and no longer meet the criteria for being exempt from civil service protections, or perhaps it was a new position that was added during the budget.",random,0.0,False
cdp-seattle-21723dcf,c41fc65bed07,"So without further ado, my understanding is that we do not have any folks signed up for public comment or anyone in the weight room.",random,0.0,False
cdp-seattle-21723dcf,6665642163d8,The next item on the agenda is the approval of uses and accepting surveillance impact reports.,random,0.0,False
cdp-seattle-21723dcf,6665642163d8,We'll see you later.,random,0.0,False
cdp-seattle-21723dcf,6665642163d8,The city of Seattle is committed to undergoing extensive review process by the executive departments.,random,0.0,False
cdp-seattle-21723dcf,6665642163d8,The committee recommends the bill pass as amended.,random,0.0,False
cdp-seattle-21723dcf,6665642163d8,That this technology is used to find people with outstanding warrants.,random,0.0,False
cdp-seattle-21723dcf,82da1b59e1d5,"Council bill 120021, the land marking agreement for the Swedish Club, five appointments to the community involvement and 5 to the urban forestry Commission.",random,0.0,False
cdp-seattle-21723dcf,82da1b59e1d5,"It looks like, I think, amendment one, two, and four, I will address amendment three, which is my amendment.",random,0.0,False
cdp-seattle-21723dcf,82da1b59e1d5,"The Senate, $500 million, the house, $600 million.",random,0.0,False
cdp-seattle-21723dcf,82da1b59e1d5,Then we will go ahead and move to the next agenda item.,random,0.0,False
cdp-seattle-21723dcf,82da1b59e1d5,"Good morning, colleagues, I know you asked us to be wrapped by 11:00 a.m. which is four minutes away, so I will be brief.",random,0.0,False
cdp-seattle-21723dcf,82da1b59e1d5,The climate commitment act last Monday after our briefing was voted out of ways and means . It is now in the rules committee.,random,0.0,False
cdp-seattle-21723dcf,82da1b59e1d5,"Hearing no comments, will the clerk please call the roll on the passage of the bill?, you have a question?",random,0.0,False
cdp-seattle-21723dcf,82da1b59e1d5,We want to keep costs down to keep rates low.,random,0.0,False
cdp-seattle-21723dcf,82da1b59e1d5,Great.,random,0.0,False
cdp-seattle-21723dcf,82da1b59e1d5,"I think it is a commonsense way of making the right to Council bill legally defensible and accessible to those tenants who cannot afford a lawyer . again, if you have any additional questions about amendment three before 2:00, today, you can contact me directly, or your staff is welcome to reach out to my senior policy advisor in my office, and also, [Indiscernible] is available to answer any questions or concerns you might have about amendment three.",random,0.0,False
cdp-seattle-21723dcf,777b2396616a,They're determined humanitarian standards.,random,0.0,False
cdp-seattle-21723dcf,777b2396616a,It is only by constantly making society aware of the injustices and indicating society's condemnation via appropriate sanctions that society can then establish values and systems that strive for justice and reform.,random,0.0,False
cdp-seattle-21723dcf,777b2396616a,"The minutes of the City Council meeting of June 28th, 2021 have been reviewed.",random,0.0,False
cdp-seattle-21723dcf,777b2396616a,"Hello, my name is Thomas, and I would like to speak about how we should not allow our police to be trained by people who violate human rights.",random,0.0,False
cdp-seattle-21723dcf,777b2396616a,Eight present.,random,0.0,False
cdp-seattle-21723dcf,777b2396616a,Is there a second?,random,0.0,False
cdp-seattle-21723dcf,777b2396616a,"We were so close once again, try one more time, star six.",random,0.0,False
cdp-seattle-21723dcf,777b2396616a,"And since we have such a large issue with police violating human rights, we need to start by preventing it from the beginning.",random,0.0,False
cdp-seattle-21723dcf,777b2396616a,"I urge the council to support the July Supplemental Budget Amendment that Council Member Sawant has announced she's going to bring to use $500,000 of the 5.4 million that the council already voted to take out of the police department to invest in the Garfield Superblock Project.",random,0.0,False
cdp-seattle-21723dcf,01a6d09dd442,In Thursday's committee meeting we will discuss with the community panel of renters and renter rights advocates and with City Council central staff members about the 3 renters rights bills from my office of the committee began discussing last week the first bill requires landlords.,random,0.0,False
cdp-seattle-21723dcf,01a6d09dd442,Whereas here.,random,0.0,False
cdp-seattle-21723dcf,01a6d09dd442,This resolution is co-sponsored by councilmembers herbold and morales as many of you know clarence acox jr is a legendary and award-winning drummer and jazz band director for decades at garfield high school our committee unanimously recommended this resolution be approved our transportation utilities committee also unanimously recommended adoption of resolution 32007 which is the updated strategic plan for seattle city light last week our committee heard from last week our committee heard from the city light review panel about why they fully endorse city light strategic plan it's a multi-year plan for implementing the mission of this one billion dollar city-owned utility enterprise which provides affordable reliable and environmentally responsible electricity to over 900 000 people in seattle and surrounding areas despite several cost pressures including the covid pandemic seattle city light has surpassed expectations in keeping their rate increases under control city light also succeeded in not increasing the bills of electricity electricity customers this year when its customers were the most vulnerable moreover city lights proposed rate path will also have a lower than expected rate increase in the future as compared to their previous strategic plan the net result is a six-year average annual increase will be less than 3.5 percent instead of the original 4.5 percent on january 16th,random,0.0,False
cdp-seattle-21723dcf,01a6d09dd442,It is now 930 at will the clerk for bold.,random,0.0,False
