infra,session_id,sentence,type,similarity,label
cdp-seattle-21723dcf,79e99b4d52d7,There are no public commenters.,open,0.5442304,False
cdp-seattle-21723dcf,79e99b4d52d7,I don't believe we have anyone signed up for public comment.,open,0.53393054,False
cdp-seattle-21723dcf,79e99b4d52d7,We are adjourned.,open,0.41083416,False
cdp-seattle-21723dcf,c680bc60dca9,The public comment period is now open.,open,0.98621297,True
cdp-seattle-21723dcf,c680bc60dca9,"At this time, I will be opening the remote public comment period.",open,0.72735906,True
cdp-seattle-21723dcf,c680bc60dca9,The public comment link is also listed on today's agenda.,open,0.6736109,False
cdp-seattle-21723dcf,1ca25fd1350f,The public comment period is now.,open,0.8508403,True
cdp-seattle-21723dcf,1ca25fd1350f,The public comment period is going to be 20 minutes.,open,0.7049476,False
cdp-seattle-21723dcf,1ca25fd1350f,I will move on to public comment and give the the the normal admonitions hear about the remote public comment period.,open,0.65196943,True
cdp-seattle-21723dcf,72d669a798e7,And we will start with 20 minutes of public comment this morning and then move right into it.,open,0.5744364,False
cdp-seattle-21723dcf,72d669a798e7,"Last week, the FDA announced that the comment period had been extended for another 90 days based on the scope of the document and request from community.",open,0.48312482,False
cdp-seattle-21723dcf,72d669a798e7,"So if you intended on making comments about the budget, I'd ask for you to hold those comments until we convene as a select budget committee, which will happen as soon as we adjourn here.",open,0.41587305,False
cdp-seattle-21723dcf,6975777e9223,At this time we will open the remote general public comment period.,open,0.75672984,True
cdp-seattle-21723dcf,6975777e9223,The regular public comment period for this committee meeting is now open and we will begin with the first speaker on the list.,open,0.6713718,True
cdp-seattle-21723dcf,6d911f4e851c,"With that, the public comment period is now open, and we'll begin the first speaker on the list.",open,0.7446557,True
cdp-seattle-21723dcf,6d911f4e851c,The public comment period is 20 minutes.,open,0.69866216,False
cdp-seattle-21723dcf,6d911f4e851c,The public comment link is also on today's agenda.,open,0.6505568,False
cdp-seattle-21723dcf,669c54584054,"It's supposed to be open in the middle of next year, not the end of next year.",open,0.40574932,False
cdp-seattle-21723dcf,669c54584054,"And then, of course, looking forward to tomorrow night's very long and extensive public comment from the community, which I'm very much looking forward to.",open,0.3933821,False
cdp-seattle-21723dcf,669c54584054,"We don't have anything else to discuss, so we will be adjourned for today, and I will see you all at 2 o'clock.",open,0.38206986,False
cdp-seattle-21723dcf,a2161ab2ea79,So we will close out public comment given that there is nobody in the waiting room to give us public comment and begin on other items of business on our agenda.,open,0.6603253,False
cdp-seattle-21723dcf,a2161ab2ea79,We are going to look at the public comment sheet here.,open,0.6266443,False
cdp-seattle-21723dcf,a2161ab2ea79,There are no public comment registrants.,open,0.5410001,False
cdp-seattle-21723dcf,03e2809fffe1,"We have reached the end of our agenda, and our next meeting is actually a public hearing.",open,0.4163158,False
cdp-seattle-21723dcf,03e2809fffe1,It is out of date as of the time we submitted it to you.,open,0.37973487,False
cdp-seattle-21723dcf,03e2809fffe1,Last category here is supporting city workers and reopening.,open,0.3574366,False
cdp-seattle-21723dcf,fd7f4922bcc3,"We will start with the first session being on public hearing, a public comment period, again, for 30 minutes.",open,0.5815909,False
cdp-seattle-21723dcf,fd7f4922bcc3,"We will cut public comment off at 10, so we have enough time to get into the meat of the presentation, so we're going to start with Office of Housing.",open,0.50669944,False
cdp-seattle-21723dcf,fd7f4922bcc3,I am not seeing any additional comments at this point.,open,0.44835615,False
cdp-seattle-21723dcf,e67588012aa2,It is 2.02 p.m.,open,0.27820012,False
cdp-seattle-21723dcf,e67588012aa2,"So, colleagues, we have a very full agenda today, and I want to respect and thank particularly the appointees who are here, but I do want to say that given that the Chauvin verdict is about to be announced, I think it's appropriate for us to reschedule this committee meeting.",open,0.2476959,False
cdp-seattle-21723dcf,e67588012aa2,"The April 20, 2021 meeting of the Community Economic Development Committee will come to order.",open,0.24616532,False
cdp-seattle-21723dcf,19555e51df3c,"At this time, we will begin the open, we will open the remote public comment period for the items on today's agenda.",open,0.7441203,True
cdp-seattle-21723dcf,19555e51df3c,"And seeing as we have no additional speakers signed up or remotely present, the public comment period is now closed.",open,0.7384787,False
cdp-seattle-21723dcf,19555e51df3c,"The public comment period is now open, and we will begin with the first speaker on the list.",open,0.73160374,True
cdp-seattle-21723dcf,80858d2f932a,It reminds the strong intent of the city council to have remote public comment regularly included on meeting agendas however as a reminder city council reserves the right to end or eliminate these public comment periods at any point we deem that the system is being abused or is no longer suitable for allowing our meetings to be conducted efficiently and effectively I will moderate public comment period in the following manner the public comment period since we have 10 speakers will be for 20 minutes and each speaker will be given two minutes to speak speakers are called upon in the order in which they registered to provide public comment on the council's website each speaker must call in from the phone number used for the registration and using the meeting phone number id and passcode that was emailed to them upon confirmation this is different than the general meeting listen line calling information I'm at this time only seeing one individual not present Jim Wilson again I will call on each speaker by name and in the order in which they registered on the council's website if you have not yet registered to speak and would like to you can sign up before the end of public comment by going to the council's website at seattle.gov forward slash council the public comment link is also listed on today's agenda once I call on the speaker's name staff will unmute the appropriate microphone and an automatic prompt if you have been unmuted will be the speaker's cue that is their turn to speak and then the speaker must press star six to begin speaking please begin speaking by stating your name and the item in which you are addressing as a reminder public comment should relate to an item on today's agenda and or introduction referral calendar so we are just commenting on today's agenda and introduction or referral calendar speakers will hear a chime when 10 seconds are left of the allotted time once you hear that chime we ask to begin to wrap up public comment speakers do not end their public comments at the end of the allotted time provided the speaker's microphone will be unmuted will be muted to allow us to call on the next speaker once you have completed your public comment we ask you please disconnect from the line and if you plan to continue following the meeting please do so via seattle channel or the listening options listed on the agenda the public comment period is now open and we will begin with the first speaker on a list,open,0.4877519,False
cdp-seattle-21723dcf,80858d2f932a,Good morning mr gale how good afternoon mr gale how are you today good afternoon howard gale and i want the clock to stop because council member straus you've incorrectly stated what the rules are for public comment public comment for committees is different from the full council anyone can comment on items in the full council that have to do with the yearly action plan and that includes the budget and that includes public safety so i would like my time to be restarted and i would also like again to state for other listeners that the uh stipulations stated by council member straus are wholly incorrect mr gale good afternoon would you like to clerk you can restart the clock we will accept mr gale we will accept comments on the work plan today yes and um because i'd rather us continue in a good way than to have an argument today so two minutes have been restarted and there you go thank you howard gale district 7 speaking on budget and failed police accountability part of the council's work plan last week kow published more information on the ongoing oig scandal involving a failure of the opa to properly investigate police abuse and a failure of the oig to perform its mandated function of providing a critical review of opa investigations,open,0.40536958,False
cdp-seattle-21723dcf,80858d2f932a,We're having the public hearing this afternoon and then plan to vote on the requested alley vacation at our full council meeting next week approval of the alley vacation would facilitate the development of this mixed use mixed income project to be built near frequent fixed transit transit of our growing uh which includes our growing light rail system nearly half of the 771 new residential units would be affordable to low-income families under 60 of the area median income i look forward to the comments during today's public hearing thank you thank you council member peterson as presiding officer i'm now opening the public hearing on clerk file three one four four five nine relating to a petition of grand street commons llc for an alley vacation of block 14 joe joe's c kinnears addition to the city of seattle beginning of the block bounded by south grand street uh 22nd avenue south south whole gate and 23rd avenue south the online registration to speak opened at 12 noon today and i will call on speakers in the order in which they registered the online registration will remain open until the conclusion of this public hearing the same rules applied to the public comment period will be applied to this public hearing each speaker will be provided two minutes to speak and each speaker will hear a chime when they have 10 seconds left of the allotted time speakers microphones will be muted at the end of the allotted public comment time public comment relating to clerk file to the clerk file is only being accepted at this public hearing speakers are asked to begin their public comments by stating their name please remember to press star six not pound six star six after you you hear the prompt if you have been unmuted bringing up the list here we have randall olson allison van gorp susan davis melissa weschler maria barrientos and david tan randall good afternoon welcome thank thank you for the opportunity to comment today my name is randall olson i'm a land use attorney at cairn cross and implement in seattle i represent mount baker housing regarding this project this is an exciting day i have been working with mount baker housing on the valley vacation for over two years and it has been a very long journey but the city should be proud of what it is helping to achieve here including the 206 units of affordable housing at 60 percent ami just in the mount baker housing portion of this project there'll be over 350 units of affordable housing across the entire project and my comment today is to voice support for approval of the alley vacation and i also ask that you support and approve council may council member mosquitos proposed amendment which would waive the requirement for mount baker housing to pay the city for the vacated alley as the council knows from from tackling this issue of affordable housing for many years affordable housing projects face many of the same permitting and construction cost issues that market rates and housing does lumber steel concrete it takes to build affordable housing is the same it takes for market rate housing and the costs are the same same with the permitting process so those costs limit how much affordable housing can be built and funded here the city's office of housing is funding the construction of mount baker housing affordable housing building and council member mosquitos amendment would waive the requirement for mount baker housing to pay for the vacated alley land which the effect of of that would be to keep affordable housing dollars with the office of housing where they could be deployed to construct more affordable housing in the city so the the issue of developing affordable housing is not one of a lack of desire but rather a lack of funding and council member mosquitos amendment is an easy way to allocate more dollars towards affordable housing so please approve the alley vacation and the proposed amendment thank you very much thank you randall,open,0.36092612,False
cdp-seattle-21723dcf,5209ff58fc05,"So if there is no objection, the public comment period will be extended from 20 minutes to 30 minutes.",open,0.6777977,False
cdp-seattle-21723dcf,5209ff58fc05,So we will finish public comment at approximately 2.41 p.m.,open,0.6644746,False
cdp-seattle-21723dcf,2ed157aaefab,"At this time, we will move into public comment.",open,0.64485615,True
cdp-seattle-21723dcf,2ed157aaefab,We have five people signed up for public comment.,open,0.54635835,False
cdp-seattle-21723dcf,2ed157aaefab,"I will moderate the public comment period, allowing each Speaker two minutes to speak.",open,0.5432584,False
cdp-seattle-21723dcf,4064eda8412c,"We have no further items of business for our agenda, so we are adjourned, and I will see you all at 2 o'clock.",open,0.40712202,False
cdp-seattle-21723dcf,4064eda8412c,I'm excited to be able to provide kickoff comments at that particular event virtually.,open,0.38982898,False
cdp-seattle-21723dcf,4064eda8412c,"Amendments were due last week to central staff, but I know some people need some more time.",open,0.3600618,False
cdp-seattle-21723dcf,3b729b651d17,I've got it open now.,open,0.527061,False
cdp-seattle-21723dcf,3b729b651d17,"Because the appeals are quasi judicial matters, the committee is not able to accept public comment today.",open,0.46911544,False
cdp-seattle-21723dcf,3b729b651d17,There were comments.,open,0.4651921,False
cdp-seattle-21723dcf,a1d5b6c025e4,I will go ahead and open up the record from session 2 on today's agenda.,open,0.34943748,False
cdp-seattle-21723dcf,a1d5b6c025e4,I'm going to turn it over to our budget lead from central staff to remind us of the process for submitting your questions to central staff so we can compile those in one place.,open,0.28307438,False
cdp-seattle-21723dcf,a1d5b6c025e4,"And if not, of course, feel free to introduce yourself as our presentation commences.",open,0.25667697,False
cdp-seattle-21723dcf,9b6de70aa7c9,So the public comment period is now open and we're going to begin with the first speaker on the list.,open,0.70166683,True
cdp-seattle-21723dcf,9b6de70aa7c9,"So if there is no objection, the public comment period will be extended to 60 minutes.",open,0.6625401,False
cdp-seattle-21723dcf,9b6de70aa7c9,"Hearing no objection, the public comment period is now extended to 60 minutes, if we need to extend it a little further to allow for everyone to address the city council this afternoon, we will make sure to do that accordingly.",open,0.63942456,False
cdp-seattle-21723dcf,7b04af85d970,That closes public comment for today.,open,0.6946844,False
cdp-seattle-21723dcf,7b04af85d970,"If you'd like to offer public comment before we close the public comment period, you're welcome to still sign up.",open,0.6909033,False
cdp-seattle-21723dcf,7b04af85d970,"The public comment period is now open, and we'll begin with the first three speakers on the list.",open,0.667789,True
cdp-seattle-21723dcf,ddf1cd13cc6e,"The public comment period is now open, and I will go to the first three speakers.",open,0.75238395,True
cdp-seattle-21723dcf,ddf1cd13cc6e,"That concludes our public comment for this morning, and we will make sure, if we do receive any written public comment, that we circulate those to other Councilmembers.",open,0.58715975,False
cdp-seattle-21723dcf,ddf1cd13cc6e,Thank you so much for allowing public comment today.,open,0.5752865,False
cdp-seattle-21723dcf,66b466035bb7,So with that being said we are gonna go ahead and now open up the period of public comment.,open,0.7854147,True
cdp-seattle-21723dcf,66b466035bb7,"Hearing no objection, the public comment period is extended to 2 40 p.m.",open,0.6677891,False
cdp-seattle-21723dcf,b3c9f239a5c3,Public comment period is now open.,open,0.9805967,True
cdp-seattle-21723dcf,b3c9f239a5c3,So we're going to go ahead and open up the public comment period.,open,0.8016099,True
cdp-seattle-21723dcf,b3c9f239a5c3,"So if there's no objection, the public comment period will be extended to a total of 60 minutes for today.",open,0.67836505,False
cdp-seattle-21723dcf,856cad24e151,So public comment is now open.,open,0.8643329,True
cdp-seattle-21723dcf,5a55204b9128,"Checking public comment, I see that the last three public commenters are still showing is not present, so with that, we will conclude public comment.",open,0.72120583,False
cdp-seattle-21723dcf,5a55204b9128,"At this time, we will transition into public comment.",open,0.6757506,True
cdp-seattle-21723dcf,5a55204b9128,I will moderate the public comment period in the following manner.,open,0.60204655,False
cdp-seattle-21723dcf,37f33152b1ea,So we will close the public comment session.,open,0.69695306,False
cdp-seattle-21723dcf,37f33152b1ea,The public comment period for this meeting is 20 minutes.,open,0.6294991,False
cdp-seattle-21723dcf,37f33152b1ea,I'll moderate the public comment period in the following manner.,open,0.6108875,False
cdp-seattle-21723dcf,531b035f4dbd,"Our committee on Tuesday, October 26th, we'll start with public comment.",open,0.58563644,False
cdp-seattle-21723dcf,531b035f4dbd,They expect it to remain closed today.,open,0.39604956,False
cdp-seattle-21723dcf,531b035f4dbd,"Again, a reminder, we start at 9 30 AM, 30 minutes of public testimony.",open,0.37471566,False
cdp-seattle-21723dcf,c5cfcff2fa7d,"I wanted to go back to the comments, um, The comments that, uh, chair Strauss had made about the importance of this legislation already, including public benefits.",open,0.44617116,False
cdp-seattle-21723dcf,c5cfcff2fa7d,We are adjourned for today.,open,0.41657868,False
cdp-seattle-21723dcf,c5cfcff2fa7d,"I mean, council member Strauss is saying this is to last minute and yes, the amendment did comment, uh, come on Sunday.",open,0.39646372,False
cdp-seattle-21723dcf,5930000b2d24,"At this time, we'll open the remote general public comment period.",open,0.73726064,True
cdp-seattle-21723dcf,5930000b2d24,"In that case, I'll dispense with the very long script about public comment, and we will close the public comment period now.",open,0.69104564,False
cdp-seattle-21723dcf,5930000b2d24,"I ask everyone to be patient as we operate this online system, and it remains the strong intent of the Council to have public comment regularly during meeting agendas.",open,0.50385344,False
cdp-seattle-21723dcf,f108cb7e78d0,The public comment period will go for 45 minutes,open,0.7318641,False
cdp-seattle-21723dcf,f108cb7e78d0,So folks who are signed up for public comment Please note that you will have one minute to provide public comment today And there will be many more opportunities to provide public comment in the upcoming two meetings Plus the upcoming full council meeting at this time.,open,0.64773554,False
cdp-seattle-21723dcf,f108cb7e78d0,"We do want to open up remote public comment We know that um time is restricted So appreciate you getting in your high level points and then following up with us with any additional information You may want to share at seattle Um at council, excuse me at council at seattle.gov",open,0.559642,False
cdp-seattle-21723dcf,194244d9e1fc,"Before we begin our agenda items, we, of course, have public comment.",open,0.54468155,False
cdp-seattle-21723dcf,194244d9e1fc,There are no other people who are showing up as present who are signed up for public comment.,open,0.5015076,False
cdp-seattle-21723dcf,194244d9e1fc,"Ted, just to confirm, are the other people who are signed up for public comment showing up as present?",open,0.48478585,False
cdp-seattle-21723dcf,45c09769ab78,The public has until May 7th at 5pm to offer comments to those rules.,open,0.59027886,False
cdp-seattle-21723dcf,45c09769ab78,I want to thank everybody who called in during the public comment periods.,open,0.4430008,False
cdp-seattle-21723dcf,45c09769ab78,OLS will consider any comments that aim to provide clarity and finalize the chapter in the upcoming months.,open,0.42006946,False
cdp-seattle-21723dcf,bb3e9a8ee7a3,The public comment period will be 20 minutes.,open,0.71150154,False
cdp-seattle-21723dcf,bb3e9a8ee7a3,"So now that we've walked through the agenda, I would like to open the public comment.",open,0.7114386,True
cdp-seattle-21723dcf,bb3e9a8ee7a3,"And with that, the public comment period is now open, and we will begin with the first speaker on the list.",open,0.7016907,True
cdp-seattle-21723dcf,40b9ede727a1,"Okay, I'm going to go ahead and open up the period of public comment now.",open,0.7872461,True
cdp-seattle-21723dcf,40b9ede727a1,We're now closing out the period of public comment and moving to other items of business on our agenda.,open,0.68052626,False
cdp-seattle-21723dcf,40b9ede727a1,"So if there's no objection, the public comment period will be extended to 30 minutes.",open,0.6722547,False
cdp-seattle-21723dcf,7f47079884fb,We are dedicating the entire evening to this so that's why this morning's agenda doesn't include public comment for us to accept public comment.,open,0.5735317,False
cdp-seattle-21723dcf,7f47079884fb,"I'm going to now move to suspend the rules to allow for the meeting to continue without public comment at this morning's meeting recognizing during this same day, throughout the evening, we will hear directly from members of the public.",open,0.56749827,False
cdp-seattle-21723dcf,7f47079884fb,And all of the opportunities to provide public comment are listed on the agenda for this afternoon.,open,0.5595656,False
cdp-seattle-21723dcf,0bc6e006b028,At this time we will move into public comment.,open,0.6633984,True
cdp-seattle-21723dcf,0bc6e006b028,We've got 11 people signed up for public comment today.,open,0.559939,False
cdp-seattle-21723dcf,09e8ad8f49ba,"And again, tomorrow morning, public comment opens up at 7.30 a.m. for sign-up, and we will have the first 30 minutes dedicated to public comment as well.",open,0.7639696,False
cdp-seattle-21723dcf,09e8ad8f49ba,"We do have a lot of people sign up for public comment and as I have noted in every meeting, we will have public comment at the beginning of every meeting.",open,0.6173305,False
cdp-seattle-21723dcf,94fc8f2e670b,"At this time, we will open the remote general public comment period.",open,0.7536358,True
cdp-seattle-21723dcf,b6ea23f7a9a3,I will moderate the public comment period today and we will have a public comment period for this meeting to last a total of 20 minutes.,open,0.65958655,False
cdp-seattle-21723dcf,b6ea23f7a9a3,"Colleagues at this time we will open the remote public comment period for items on the City Council agenda, introduction, referral calendar and the council's work program.",open,0.65415204,True
cdp-seattle-21723dcf,07b950311439,"The public reopening of City Hall that was scheduled for today, August 2, has been delayed indefinitely to an undetermined date in the future.",open,0.40606165,False
cdp-seattle-21723dcf,07b950311439,The bill came up previously in June where we extended the proviso to allow for this additional time for discussion with the Associated Departments and work units.,open,0.36482722,False
cdp-seattle-21723dcf,b8891923b600,At the time we will transition into public comment.,open,0.69714516,True
cdp-seattle-21723dcf,b8891923b600,The agenda shows we have 20 minutes for public comment.,open,0.5844563,False
cdp-seattle-21723dcf,062f6b2b2003,"At this time, we will open the remote public comment period.",open,0.77841884,True
cdp-seattle-21723dcf,062f6b2b2003,"As Monica mentioned, this is when we also opened up the public comment period, which will continue through December 11th and include the opportunity to submit written comments and also to attend three meetings and provide public comment.",open,0.72016346,False
cdp-seattle-21723dcf,f18ba226a2cd,The public comment period is now open and we will begin with the first speaker on the list.,open,0.71718645,True
cdp-seattle-21723dcf,f18ba226a2cd,Public comment period for this meeting is going to be 20 minutes.,open,0.65200335,False
cdp-seattle-21723dcf,726ec414e79f,I'm now going to open up the public comment period.,open,0.81907487,True
cdp-seattle-21723dcf,726ec414e79f,"We're now going to move to public comment period, colleagues.",open,0.70268154,True
cdp-seattle-21723dcf,726ec414e79f,"At this time, we will open the remote public comment period for items on the City Council agenda, introduction and referral calendar, and the Council's work program.",open,0.6595677,True
cdp-seattle-21723dcf,ad93acca5e2b,Seeing as we have no additional speakers present the public comment period is now open and we will move on to the next agenda item.,open,0.7850998,True
cdp-seattle-21723dcf,ad93acca5e2b,The public comment period is up to 10 minutes.,open,0.7504653,False
cdp-seattle-21723dcf,c41fc65bed07,So we are going to go ahead and close out the public comment period since we do not have any public comment registrants.,open,0.7519766,False
cdp-seattle-21723dcf,c41fc65bed07,"Just quickly before we open up public comment, we have three items of business.",open,0.48364678,False
